{"artifactType":"nature-spatial-cell-package","cellId":"8/216/109","contentHash":"sha256:b30eb0ee4bcb2cc5bd8a968561affeb852c998098c2a89a26a3889acf733d994","entities":[{"access":{"carStatus":null,"legal":"unknown","modes":["car","foot"],"original":["car","foot"]},"activities":["walking"],"classifications":[{"normalized":"viewpoint_panorama","original":"viewpoint-panorama","system":"itinera-legacy"}],"deliveryRegions":["japan"],"discovery":{"distinctiveness":0.7,"lane":"quieter_lead","visitorProminence":0},"elevationMeters":40,"entityType":"NaturalFeature","geometry":{"coordinates":[124.31389,24.59722],"type":"Point"},"id":"legacy-place:assets-js-japan-pois-js-1438:rt0ktw","jurisdictionIds":["JP","JP-25"],"legacy":{"compactRecord":{"access":["car","foot"],"cat":"viewpoint-panorama","co":"JP","dur":1.5,"e":40,"la":24.59722,"lo":124.31389,"n":"Hirakubozaki Cape Lighthouse","region":"Okinawa / Yaeyama-Ishigaki","rs":"Drive an hour to feel like the only people in the prefecture: open headland, no railings, a tiny lighthouse, and an unbroken horizon. After sunset, the Milky Way is brutal.","sc":7,"season":["spring","summer","autumn","winter"],"td":"Northern tip of Ishigaki, at the end of a 25 km drive up the slender Hirakubo peninsula. A small white 1972 lighthouse sits on grassy bluffs above two oceans — Pacific to the east, East China Sea to the west — with the disputed Senkaku Islands ~170 k","themes":["panoramic-view","photogenic","car-accessible","hidden-gem","year-round"],"wl":"en","wt":"Hirakubozaki Lighthouse"},"ordinalId":"poi1438","sourcePath":"assets/js/japan-pois.js"},"names":[{"kind":"primary","language":"en","value":"Hirakubozaki Cape Lighthouse"},{"kind":"alternate","language":"en","value":"Hirakubozaki Lighthouse"}],"notabilityScore":7,"originalSourceIds":[{"recordId":"japan-pois.js#1438","sourceId":"legacy-curated-pois"}],"quality":{"accessConfidence":0.18,"assessedAt":"2026-07-25","confidence":0.31,"flags":["discovery_lead","legacy_inventory","legacy_provenance_incomplete","sensitivity_not_assessed","unverified_migration_preview"],"freshness":"unknown","geometryConfidence":0.39,"notes":"Unverified migration/discovery preview; migrated without upgrading the evidence status of the legacy record. Unverified migration/discovery preview; not a verified production fact.","verificationStatus":"unverified"},"rationale":"Drive an hour to feel like the only people in the prefecture: open headland, no railings, a tiny lighthouse, and an unbroken horizon. After sunset, the Milky Way is brutal.","schemaVersion":"1.0.0","seasons":["autumn","spring","summer","winter"],"sensitivity":{"action":"publish","reason":"Location was already public in the legacy application; sensitivity remains unassessed."},"sourceAssertions":[{"confidence":0.31,"evidenceKind":"maintainer_curated","fieldPath":"/","id":"legacy-place:assets-js-japan-pois-js-1438:rt0ktw:source","notes":"Migrated from assets/js/japan-pois.js; upstream provenance and licence need review.","observedAt":null,"retrievedAt":null,"sourceId":"legacy-curated-pois","sourceRecordId":"japan-pois.js#1438","validFrom":null,"validUntil":null,"verificationStatus":"unverified"},{"confidence":0.31,"evidenceKind":"maintainer_curated","fieldPath":"/geometry","id":"legacy-place:assets-js-japan-pois-js-1438:rt0ktw:geometry","notes":"Migrated from assets/js/japan-pois.js; upstream provenance and licence need review.","observedAt":null,"retrievedAt":null,"sourceId":"legacy-curated-pois","sourceRecordId":"japan-pois.js#1438","validFrom":null,"validUntil":null,"verificationStatus":"unverified"},{"confidence":0.31,"evidenceKind":"maintainer_curated","fieldPath":"/names","id":"legacy-place:assets-js-japan-pois-js-1438:rt0ktw:names","notes":"Migrated from assets/js/japan-pois.js; upstream provenance and licence need review.","observedAt":null,"retrievedAt":null,"sourceId":"legacy-curated-pois","sourceRecordId":"japan-pois.js#1438","validFrom":null,"validUntil":null,"verificationStatus":"unverified"}],"summary":"Northern tip of Ishigaki, at the end of a 25 km drive up the slender Hirakubo peninsula. A small white 1972 lighthouse sits on grassy bluffs above two oceans — Pacific to the east, East China Sea to the west — with the disputed Senkaku Islands ~170 k","themes":["car-accessible","hidden-gem","panoramic-view","photogenic","year-round"],"typicalVisitMinutes":90}],"generated":true,"schemaVersion":"1.0.0","shardCount":1,"shardIndex":0,"x":216,"y":109,"zoom":8}
