{"artifactType":"nature-spatial-cell-package","cellId":"8/127/82","contentHash":"sha256:6aba4f1b7b62636c1f47ee99c2fe685cd8ef243161481e8fda18cb0bd2f6ef68","entities":[{"access":{"carStatus":null,"legal":"unknown","modes":["car","transit","foot"],"original":["car","train","bus","foot"]},"activities":["walking"],"classifications":[{"normalized":"old_town","original":"old-town","system":"itinera-legacy"}],"deliveryRegions":["uk-ireland"],"discovery":{"distinctiveness":0.9,"lane":"iconic","visitorProminence":1},"elevationMeters":15,"entityType":"Place","geometry":{"coordinates":[-1.0815,53.959],"type":"Point"},"id":"legacy-place:assets-js-uk-pois-js-1473:1it4cpp","jurisdictionIds":["GB-ENG"],"legacy":{"compactRecord":{"access":["car","train","bus","foot"],"cat":"old-town","co":"GB","dur":6,"e":15,"la":53.959,"lo":-1.0815,"n":"York historic centre","region":"England / Yorkshire","rs":"England's most complete historic city experience outside London, with exceptional street texture and museums.","sc":9,"season":["spring","summer","autumn","winter"],"td":"Layered Roman, Viking and medieval city enclosed by walkable walls and dominated by York Minster.","themes":["historic","architecture","year-round","food-drink","family-friendly","iconic"],"wl":"en","wt":"York"},"ordinalId":"poi1473","sourcePath":"assets/js/uk-pois.js"},"names":[{"kind":"primary","language":"en","value":"York historic centre"},{"kind":"alternate","language":"en","value":"York"}],"notabilityScore":9,"originalSourceIds":[{"recordId":"uk-pois.js#1473","sourceId":"legacy-curated-pois"}],"quality":{"accessConfidence":0.18,"assessedAt":"2026-07-25","confidence":0.31,"flags":["discovery_lead","legacy_inventory","legacy_provenance_incomplete","sensitivity_not_assessed","unverified_migration_preview"],"freshness":"unknown","geometryConfidence":0.39,"notes":"Unverified migration/discovery preview; migrated without upgrading the evidence status of the legacy record. Unverified migration/discovery preview; not a verified production fact.","verificationStatus":"unverified"},"rationale":"England's most complete historic city experience outside London, with exceptional street texture and museums.","schemaVersion":"1.0.0","seasons":["autumn","spring","summer","winter"],"sensitivity":{"action":"publish","reason":"Location was already public in the legacy application; sensitivity remains unassessed."},"sourceAssertions":[{"confidence":0.31,"evidenceKind":"maintainer_curated","fieldPath":"/","id":"legacy-place:assets-js-uk-pois-js-1473:1it4cpp:source","notes":"Migrated from assets/js/uk-pois.js; upstream provenance and licence need review.","observedAt":null,"retrievedAt":null,"sourceId":"legacy-curated-pois","sourceRecordId":"uk-pois.js#1473","validFrom":null,"validUntil":null,"verificationStatus":"unverified"},{"confidence":0.31,"evidenceKind":"maintainer_curated","fieldPath":"/geometry","id":"legacy-place:assets-js-uk-pois-js-1473:1it4cpp:geometry","notes":"Migrated from assets/js/uk-pois.js; upstream provenance and licence need review.","observedAt":null,"retrievedAt":null,"sourceId":"legacy-curated-pois","sourceRecordId":"uk-pois.js#1473","validFrom":null,"validUntil":null,"verificationStatus":"unverified"},{"confidence":0.31,"evidenceKind":"maintainer_curated","fieldPath":"/names","id":"legacy-place:assets-js-uk-pois-js-1473:1it4cpp:names","notes":"Migrated from assets/js/uk-pois.js; upstream provenance and licence need review.","observedAt":null,"retrievedAt":null,"sourceId":"legacy-curated-pois","sourceRecordId":"uk-pois.js#1473","validFrom":null,"validUntil":null,"verificationStatus":"unverified"}],"summary":"Layered Roman, Viking and medieval city enclosed by walkable walls and dominated by York Minster.","themes":["architecture","family-friendly","food-drink","historic","iconic","year-round"],"typicalVisitMinutes":360},{"access":{"carStatus":null,"legal":"unknown","modes":["car","transit","foot"],"original":["car","train","bus","foot"]},"activities":["walking"],"classifications":[{"normalized":"monastery_church","original":"monastery-church","system":"itinera-legacy"}],"deliveryRegions":["uk-ireland"],"discovery":{"distinctiveness":0.9,"lane":"iconic","visitorProminence":1},"elevationMeters":20,"entityType":"Place","geometry":{"coordinates":[-1.0819,53.9623],"type":"Point"},"id":"legacy-place:assets-js-uk-pois-js-1474:1c4ua9e","jurisdictionIds":["GB-ENG"],"legacy":{"compactRecord":{"access":["car","train","bus","foot"],"cat":"monastery-church","co":"GB","dur":2.5,"e":20,"la":53.9623,"lo":-1.0819,"n":"York Minster","region":"England / Yorkshire","rs":"The architectural and visual climax of York, with tower views over the walled city.","sc":9,"season":["spring","summer","autumn","winter"],"td":"Vast Gothic cathedral renowned for medieval stained glass, including the Great East Window.","themes":["historic","architecture","iconic","panoramic-view","year-round"],"wl":"en","wt":"York_Minster"},"ordinalId":"poi1474","sourcePath":"assets/js/uk-pois.js"},"names":[{"kind":"primary","language":"en","value":"York Minster"}],"notabilityScore":9,"originalSourceIds":[{"recordId":"uk-pois.js#1474","sourceId":"legacy-curated-pois"}],"quality":{"accessConfidence":0.18,"assessedAt":"2026-07-25","confidence":0.31,"flags":["discovery_lead","legacy_inventory","legacy_provenance_incomplete","sensitivity_not_assessed","unverified_migration_preview"],"freshness":"unknown","geometryConfidence":0.39,"notes":"Unverified migration/discovery preview; migrated without upgrading the evidence status of the legacy record. Unverified migration/discovery preview; not a verified production fact.","verificationStatus":"unverified"},"rationale":"The architectural and visual climax of York, with tower views over the walled city.","schemaVersion":"1.0.0","seasons":["autumn","spring","summer","winter"],"sensitivity":{"action":"publish","reason":"Location was already public in the legacy application; sensitivity remains unassessed."},"sourceAssertions":[{"confidence":0.31,"evidenceKind":"maintainer_curated","fieldPath":"/","id":"legacy-place:assets-js-uk-pois-js-1474:1c4ua9e:source","notes":"Migrated from assets/js/uk-pois.js; upstream provenance and licence need review.","observedAt":null,"retrievedAt":null,"sourceId":"legacy-curated-pois","sourceRecordId":"uk-pois.js#1474","validFrom":null,"validUntil":null,"verificationStatus":"unverified"},{"confidence":0.31,"evidenceKind":"maintainer_curated","fieldPath":"/geometry","id":"legacy-place:assets-js-uk-pois-js-1474:1c4ua9e:geometry","notes":"Migrated from assets/js/uk-pois.js; upstream provenance and licence need review.","observedAt":null,"retrievedAt":null,"sourceId":"legacy-curated-pois","sourceRecordId":"uk-pois.js#1474","validFrom":null,"validUntil":null,"verificationStatus":"unverified"},{"confidence":0.31,"evidenceKind":"maintainer_curated","fieldPath":"/names","id":"legacy-place:assets-js-uk-pois-js-1474:1c4ua9e:names","notes":"Migrated from assets/js/uk-pois.js; upstream provenance and licence need review.","observedAt":null,"retrievedAt":null,"sourceId":"legacy-curated-pois","sourceRecordId":"uk-pois.js#1474","validFrom":null,"validUntil":null,"verificationStatus":"unverified"}],"summary":"Vast Gothic cathedral renowned for medieval stained glass, including the Great East Window.","themes":["architecture","historic","iconic","panoramic-view","year-round"],"typicalVisitMinutes":150}],"generated":true,"schemaVersion":"1.0.0","shardCount":1,"shardIndex":0,"x":127,"y":82,"zoom":8}
