{"artifactType":"nature-spatial-cell-package","cellId":"8/219/103","contentHash":"sha256:b607910ed55f703f6949adc612d31d3d1a0c3a76aff1e18415495320dad875ba","entities":[{"access":{"carStatus":null,"legal":"unknown","modes":["ferry","car","foot"],"original":["ferry","car","foot"]},"activities":["walking"],"classifications":[{"normalized":"monastery_church","original":"monastery-church","system":"itinera-legacy"}],"deliveryRegions":["japan"],"discovery":{"distinctiveness":0.8,"lane":"quieter_lead","visitorProminence":0},"elevationMeters":0,"entityType":"Place","geometry":{"coordinates":[128.66306,32.94028],"type":"Point"},"id":"legacy-place:assets-js-japan-pois-js-1391:9z2chn","jurisdictionIds":["JP","JP-42"],"legacy":{"compactRecord":{"access":["ferry","car","foot"],"cat":"monastery-church","co":"JP","dur":4,"e":null,"la":32.94028,"lo":128.66306,"n":"Gotō Islands Hidden-Christian Churches","region":"Nagasaki / Hirado-Goto-99 Islands","rs":"Most evocative chapter of Japan's UNESCO Christian story — tiny wooden chapels on remote islands, built by the 'kakure' communities that survived 250 years underground.","sc":8,"season":["spring","summer","autumn"],"td":"Outer-island components of the UNESCO 'Hidden Christian Sites in the Nagasaki Region' (2018). Headline buildings include Egami Tenshudō on Naru Island (1918, Tetsukawa Yosuke, wooden cream-and-blue) and the brick Old Gorin Church and Kyū-Nokubi on Hi","themes":["unesco","historic","architecture","boat-accessible","hidden-gem"],"wl":"en","wt":"Egami Church"},"ordinalId":"poi1391","sourcePath":"assets/js/japan-pois.js"},"names":[{"kind":"primary","language":"en","value":"Gotō Islands Hidden-Christian Churches"},{"kind":"alternate","language":"en","value":"Egami Church"}],"notabilityScore":8,"originalSourceIds":[{"recordId":"japan-pois.js#1391","sourceId":"legacy-curated-pois"}],"quality":{"accessConfidence":0.18,"assessedAt":"2026-07-25","confidence":0.31,"flags":["discovery_lead","legacy_inventory","legacy_provenance_incomplete","sensitivity_not_assessed","unverified_migration_preview"],"freshness":"unknown","geometryConfidence":0.39,"notes":"Unverified migration/discovery preview; migrated without upgrading the evidence status of the legacy record. Unverified migration/discovery preview; not a verified production fact.","verificationStatus":"unverified"},"rationale":"Most evocative chapter of Japan's UNESCO Christian story — tiny wooden chapels on remote islands, built by the 'kakure' communities that survived 250 years underground.","schemaVersion":"1.0.0","seasons":["autumn","spring","summer"],"sensitivity":{"action":"publish","reason":"Location was already public in the legacy application; sensitivity remains unassessed."},"sourceAssertions":[{"confidence":0.31,"evidenceKind":"maintainer_curated","fieldPath":"/","id":"legacy-place:assets-js-japan-pois-js-1391:9z2chn:source","notes":"Migrated from assets/js/japan-pois.js; upstream provenance and licence need review.","observedAt":null,"retrievedAt":null,"sourceId":"legacy-curated-pois","sourceRecordId":"japan-pois.js#1391","validFrom":null,"validUntil":null,"verificationStatus":"unverified"},{"confidence":0.31,"evidenceKind":"maintainer_curated","fieldPath":"/geometry","id":"legacy-place:assets-js-japan-pois-js-1391:9z2chn:geometry","notes":"Migrated from assets/js/japan-pois.js; upstream provenance and licence need review.","observedAt":null,"retrievedAt":null,"sourceId":"legacy-curated-pois","sourceRecordId":"japan-pois.js#1391","validFrom":null,"validUntil":null,"verificationStatus":"unverified"},{"confidence":0.31,"evidenceKind":"maintainer_curated","fieldPath":"/names","id":"legacy-place:assets-js-japan-pois-js-1391:9z2chn:names","notes":"Migrated from assets/js/japan-pois.js; upstream provenance and licence need review.","observedAt":null,"retrievedAt":null,"sourceId":"legacy-curated-pois","sourceRecordId":"japan-pois.js#1391","validFrom":null,"validUntil":null,"verificationStatus":"unverified"}],"summary":"Outer-island components of the UNESCO 'Hidden Christian Sites in the Nagasaki Region' (2018). Headline buildings include Egami Tenshudō on Naru Island (1918, Tetsukawa Yosuke, wooden cream-and-blue) and the brick Old Gorin Church and Kyū-Nokubi on Hi","themes":["architecture","boat-accessible","hidden-gem","historic","unesco"],"typicalVisitMinutes":240}],"generated":true,"schemaVersion":"1.0.0","shardCount":1,"shardIndex":0,"x":219,"y":103,"zoom":8}
