{"artifactType":"nature-spatial-cell-package","cellId":"8/128/85","contentHash":"sha256:94c783072f1f46abd1deca76e73d427f18c435770eb8cbd80a66c5a712163ef6","entities":[{"access":{"carStatus":null,"legal":"unknown","modes":["car","transit","foot"],"original":["car","train","bus","foot"]},"activities":["hiking"],"classifications":[{"normalized":"viewpoint_panorama","original":"viewpoint-panorama","system":"itinera-legacy"}],"deliveryRegions":["uk-ireland"],"discovery":{"distinctiveness":0.9,"lane":"iconic","visitorProminence":1},"elevationMeters":100,"entityType":"NaturalFeature","geometry":{"coordinates":[1.3715,51.1409],"type":"Point"},"id":"legacy-place:assets-js-uk-pois-js-1490:msepiu","jurisdictionIds":["GB-ENG"],"legacy":{"compactRecord":{"access":["car","train","bus","foot"],"cat":"viewpoint-panorama","co":"GB","dur":3,"e":100,"la":51.1409,"lo":1.3715,"n":"White Cliffs of Dover","region":"England / Kent & Sussex","rs":"A national symbol whose geology, migration history and cross-Channel views are immediately legible.","sc":9,"season":["spring","summer","autumn","winter"],"td":"Bright chalk cliffs rising above the narrowest part of the English Channel, crowned by coastal paths and wartime remains.","themes":["iconic","sea-cliff","historic","panoramic-view","hike-required","car-accessible"],"wl":"en","wt":"White_Cliffs_of_Dover"},"ordinalId":"poi1490","sourcePath":"assets/js/uk-pois.js"},"names":[{"kind":"primary","language":"en","value":"White Cliffs of Dover"}],"notabilityScore":9,"originalSourceIds":[{"recordId":"uk-pois.js#1490","sourceId":"legacy-curated-pois"}],"quality":{"accessConfidence":0.18,"assessedAt":"2026-07-25","confidence":0.31,"flags":["critical_access_unknown","discovery_lead","legacy_inventory","legacy_provenance_incomplete","route_geometry_missing","sensitivity_not_assessed","unverified_migration_preview"],"freshness":"unknown","geometryConfidence":0.39,"notes":"Unverified migration/discovery preview; migrated without upgrading the evidence status of the legacy record. Unverified migration/discovery preview; not a verified production fact.","verificationStatus":"unverified"},"rationale":"A national symbol whose geology, migration history and cross-Channel views are immediately legible.","schemaVersion":"1.0.0","seasons":["autumn","spring","summer","winter"],"sensitivity":{"action":"publish","reason":"Location was already public in the legacy application; sensitivity remains unassessed."},"sourceAssertions":[{"confidence":0.31,"evidenceKind":"maintainer_curated","fieldPath":"/","id":"legacy-place:assets-js-uk-pois-js-1490:msepiu:source","notes":"Migrated from assets/js/uk-pois.js; upstream provenance and licence need review.","observedAt":null,"retrievedAt":null,"sourceId":"legacy-curated-pois","sourceRecordId":"uk-pois.js#1490","validFrom":null,"validUntil":null,"verificationStatus":"unverified"},{"confidence":0.31,"evidenceKind":"maintainer_curated","fieldPath":"/geometry","id":"legacy-place:assets-js-uk-pois-js-1490:msepiu:geometry","notes":"Migrated from assets/js/uk-pois.js; upstream provenance and licence need review.","observedAt":null,"retrievedAt":null,"sourceId":"legacy-curated-pois","sourceRecordId":"uk-pois.js#1490","validFrom":null,"validUntil":null,"verificationStatus":"unverified"},{"confidence":0.31,"evidenceKind":"maintainer_curated","fieldPath":"/names","id":"legacy-place:assets-js-uk-pois-js-1490:msepiu:names","notes":"Migrated from assets/js/uk-pois.js; upstream provenance and licence need review.","observedAt":null,"retrievedAt":null,"sourceId":"legacy-curated-pois","sourceRecordId":"uk-pois.js#1490","validFrom":null,"validUntil":null,"verificationStatus":"unverified"}],"summary":"Bright chalk cliffs rising above the narrowest part of the English Channel, crowned by coastal paths and wartime remains.","themes":["car-accessible","hike-required","historic","iconic","panoramic-view","sea-cliff"],"typicalVisitMinutes":180}],"generated":true,"schemaVersion":"1.0.0","shardCount":1,"shardIndex":0,"x":128,"y":85,"zoom":8}
