{"artifactType":"nature-spatial-cell-package","cellId":"8/134/72","contentHash":"sha256:b0246ca3e54ab529a2e52bbe0f6773df6bee10e2e03d5db5917478cdc708a066","entities":[{"accessModes":["car","ferry","foot","hiking"],"deliveryRegions":["norway"],"entityType":"AccessPoint","geometry":{"coordinates":[8.993,61.494],"type":"Point"},"id":"access:no-mainland-gjendesheim","jurisdictionIds":["NO","NO-MAINLAND"],"legalAccess":"unknown","names":[{"kind":"primary","language":"nb","value":"Gjendesheim brygge og stiinnslag"}],"originalSourceIds":[{"recordId":"no-mainland-gjendesheim","sourceId":"manual-seed-routes"}],"quality":{"accessConfidence":0.02,"assessedAt":"2026-07-26","confidence":0.24,"flags":["discovery_lead","generalized_position","legal_access_unknown","manual_seed","parking_rules_unknown","transport_stop_unverified","unverified_migration_preview"],"freshness":"unknown","geometryConfidence":0.27,"notes":"Unverified migration/discovery preview; not a verified production fact.","verificationStatus":"unverified"},"schemaVersion":"1.0.0","sensitivity":{"action":"publish","reason":"Generalized public-facing route access area."},"sourceAssertions":[{"confidence":0.24,"evidenceKind":"maintainer_curated","fieldPath":"/","notes":"Generalized boat/trail interchange; parking, landing, trail access and operating details are not asserted.","retrievedAt":null,"sourceId":"manual-seed-routes","sourceRecordId":"no-mainland-gjendesheim","verificationStatus":"unverified"}]},{"accessModes":["ferry","foot","hiking"],"deliveryRegions":["norway"],"entityType":"AccessPoint","geometry":{"coordinates":[8.487,61.549],"type":"Point"},"id":"access:no-mainland-memurubu","jurisdictionIds":["NO","NO-MAINLAND"],"legalAccess":"unknown","names":[{"kind":"primary","language":"nb","value":"Memurubu brygge og stiinnslag"}],"originalSourceIds":[{"recordId":"no-mainland-memurubu","sourceId":"manual-seed-routes"}],"quality":{"accessConfidence":0.02,"assessedAt":"2026-07-26","confidence":0.24,"flags":["discovery_lead","generalized_position","legal_access_unknown","manual_seed","transport_stop_unverified","unverified_migration_preview"],"freshness":"unknown","geometryConfidence":0.27,"notes":"Unverified migration/discovery preview; not a verified production fact.","verificationStatus":"unverified"},"schemaVersion":"1.0.0","sensitivity":{"action":"publish","reason":"Generalized public-facing route access area."},"sourceAssertions":[{"confidence":0.24,"evidenceKind":"maintainer_curated","fieldPath":"/","notes":"Generalized boat/trail interchange; landing, trail access and operating details are not asserted.","retrievedAt":null,"sourceId":"manual-seed-routes","sourceRecordId":"no-mainland-memurubu","verificationStatus":"unverified"}]},{"access":{"legal":"unknown","modes":["ferry","foot","hiking"]},"accessPointIds":["access:no-mainland-memurubu","access:no-mainland-gjendesheim"],"activities":["hiking","scrambling"],"deliveryRegions":["norway"],"entityType":"TrailRoute","geometry":{"coordinates":[[8.487,61.549],[8.555,61.538],[8.63,61.528],[8.71,61.518],[8.786,61.512],[8.883,61.504],[8.993,61.494]],"type":"LineString"},"geometryCompleteness":"complete","id":"route:no-mainland-besseggen-ridge","journeyShape":"point_to_point","jurisdictionIds":["NO","NO-MAINLAND"],"names":[{"kind":"primary","language":"nb","value":"Besseggen: Memurubu til Gjendesheim"},{"kind":"translated","language":"en","value":"Besseggen ridge: Memurubu to Gjendesheim"}],"navigationSuitability":false,"originalSourceIds":[{"recordId":"no-mainland-besseggen-ridge","sourceId":"manual-seed-routes"}],"quality":{"accessConfidence":0.04,"assessedAt":"2026-07-26","confidence":0.31,"flags":["conditions_unknown","discovery_lead","generalized_geometry","legal_access_unknown","manual_seed","not_navigation_grade","technical_character_unverified","transport_schedule_unverified","unverified_migration_preview"],"freshness":"unknown","geometryConfidence":0.3,"notes":"Tests a Norwegian point-to-point route where missing the boat could strand a user. Unverified migration/discovery preview; not a verified production fact.","verificationStatus":"unverified"},"routeNature":"established","schemaVersion":"1.0.0","sensitivity":{"action":"publish","reason":"Generalized geometry for a widely known hiking route."},"sourceAssertions":[{"confidence":0.31,"evidenceKind":"maintainer_curated","fieldPath":"/","notes":"Exact alignment, scrambling exposure, legal access, seasonal conditions and boat operation are not verified by this seed.","retrievedAt":null,"sourceId":"manual-seed-routes","sourceRecordId":"no-mainland-besseggen-ridge","verificationStatus":"unverified"}],"summary":"Generalized ridge traverse paired with a separate, schedule-unknown Gjende boat connection.","transportConnectionIds":["transport:no-mainland-gjende-boat"]},{"deliveryRegions":["norway"],"endpointIds":["access:no-mainland-gjendesheim","access:no-mainland-memurubu"],"entityType":"TransportConnection","geometry":{"coordinates":[[8.993,61.494],[8.487,61.549]],"type":"LineString"},"id":"transport:no-mainland-gjende-boat","jurisdictionIds":["NO","NO-MAINLAND"],"names":[{"kind":"primary","language":"nb","value":"Båtforbindelse Gjendesheim–Memurubu"},{"kind":"translated","language":"en","value":"Gjendesheim–Memurubu boat connection"}],"originalSourceIds":[{"recordId":"no-mainland-gjende-boat","sourceId":"manual-seed-routes"}],"quality":{"accessConfidence":0.02,"assessedAt":"2026-07-26","confidence":0.2,"flags":["discovery_lead","generalized_geometry","manual_seed","operation_unverified","schedule_unknown","unverified_migration_preview"],"freshness":"unknown","geometryConfidence":0.17,"notes":"Unverified migration/discovery preview; not a verified production fact.","verificationStatus":"unverified"},"schedule":{"freshness":"unknown","lastDepartureLocal":null,"validFrom":null,"validUntil":null},"schemaVersion":"1.0.0","sensitivity":{"action":"publish","reason":"Generalized public boat connection."},"sourceAssertions":[{"confidence":0.2,"evidenceKind":"maintainer_curated","fieldPath":"/","notes":"Generalized boat connection only. Operator, route, booking, season, accessibility, timetable and last departure require official verification.","retrievedAt":null,"sourceId":"manual-seed-routes","sourceRecordId":"no-mainland-gjende-boat","verificationStatus":"unverified"}],"transportMode":"boat"}],"generated":true,"schemaVersion":"1.0.0","shardCount":1,"shardIndex":0,"x":134,"y":72,"zoom":8}
