{"artifactType":"nature-spatial-cell-package","cellId":"8/121/85","contentHash":"sha256:d535c2b904ea04c6cbf877f12c9f79889d5a12b58a481605ae92d01fb3ee11f7","entities":[{"access":{"carStatus":null,"legal":"unknown","modes":["car","transit","foot"],"original":["car","bus","foot"]},"activities":["walking"],"classifications":[{"normalized":"bridge_engineering","original":"bridge-engineering","system":"itinera-legacy"}],"deliveryRegions":["uk-ireland"],"discovery":{"distinctiveness":0.9,"lane":"general"},"elevationMeters":90,"entityType":"Place","geometry":{"coordinates":[-9.8198,51.4506],"type":"Point"},"id":"legacy-place:assets-js-irish-pois-js-1543:1olw1c8","jurisdictionIds":["IE"],"legacy":{"compactRecord":{"access":["car","bus","foot"],"cat":"bridge-engineering","co":"IE","dur":2.5,"e":90,"la":51.4506,"lo":-9.8198,"n":"Mizen Head Signal Station","region":"Ireland / West Cork","rs":"Engineering, ocean weather and extreme-edge geography create one of the Wild Atlantic Way's signature stops.","sc":9,"season":["spring","summer","autumn"],"td":"Maritime signal station on Ireland's southwest extremity, reached across an arched bridge above a deep sea chasm.","themes":["sea-cliff","maritime","coastal","special-experience","photogenic","car-accessible"],"wl":"en","wt":"Mizen_Head"},"ordinalId":"poi1543","sourcePath":"assets/js/irish-pois.js"},"names":[{"kind":"primary","language":"en","value":"Mizen Head Signal Station"},{"kind":"alternate","language":"en","value":"Mizen_Head"}],"notabilityScore":9,"originalSourceIds":[{"recordId":"irish-pois.js#1543","sourceId":"legacy-curated-pois"}],"quality":{"accessConfidence":0.18,"assessedAt":"2026-07-25","confidence":0.31,"flags":["discovery_lead","legacy_inventory","legacy_provenance_incomplete","sensitivity_not_assessed","unverified_migration_preview"],"freshness":"unknown","geometryConfidence":0.39,"notes":"Unverified migration/discovery preview; migrated without upgrading the evidence status of the legacy record. Unverified migration/discovery preview; not a verified production fact.","verificationStatus":"unverified"},"rationale":"Engineering, ocean weather and extreme-edge geography create one of the Wild Atlantic Way's signature stops.","schemaVersion":"1.0.0","seasons":["autumn","spring","summer"],"sensitivity":{"action":"publish","reason":"Location was already public in the legacy application; sensitivity remains unassessed."},"sourceAssertions":[{"confidence":0.31,"evidenceKind":"maintainer_curated","fieldPath":"/","id":"legacy-place:assets-js-irish-pois-js-1543:1olw1c8:source","notes":"Migrated from assets/js/irish-pois.js; upstream provenance and licence need review.","observedAt":null,"retrievedAt":null,"sourceId":"legacy-curated-pois","sourceRecordId":"irish-pois.js#1543","validFrom":null,"validUntil":null,"verificationStatus":"unverified"},{"confidence":0.31,"evidenceKind":"maintainer_curated","fieldPath":"/geometry","id":"legacy-place:assets-js-irish-pois-js-1543:1olw1c8:geometry","notes":"Migrated from assets/js/irish-pois.js; upstream provenance and licence need review.","observedAt":null,"retrievedAt":null,"sourceId":"legacy-curated-pois","sourceRecordId":"irish-pois.js#1543","validFrom":null,"validUntil":null,"verificationStatus":"unverified"},{"confidence":0.31,"evidenceKind":"maintainer_curated","fieldPath":"/names","id":"legacy-place:assets-js-irish-pois-js-1543:1olw1c8:names","notes":"Migrated from assets/js/irish-pois.js; upstream provenance and licence need review.","observedAt":null,"retrievedAt":null,"sourceId":"legacy-curated-pois","sourceRecordId":"irish-pois.js#1543","validFrom":null,"validUntil":null,"verificationStatus":"unverified"}],"summary":"Maritime signal station on Ireland's southwest extremity, reached across an arched bridge above a deep sea chasm.","themes":["car-accessible","coastal","maritime","photogenic","sea-cliff","special-experience"],"typicalVisitMinutes":150}],"generated":true,"schemaVersion":"1.0.0","shardCount":1,"shardIndex":0,"x":121,"y":85,"zoom":8}
