{"artifactType":"nature-spatial-cell-package","cellId":"8/131/93","contentHash":"sha256:6d252ec6ddf5126ee3150ba5ae0cd477c1798e0cd114ae583c0578602d007e76","entities":[{"access":{"carStatus":null,"legal":"unknown","modes":["car","foot"],"original":["car","foot"]},"activities":["walking"],"classifications":[{"normalized":"village","original":"village","system":"itinera-legacy"}],"deliveryRegions":["eu-alps"],"discovery":{"distinctiveness":0.7,"lane":"quieter_lead","visitorProminence":0},"elevationMeters":630,"entityType":"Place","geometry":{"coordinates":[5.5633,43.9811],"type":"Point"},"id":"legacy-place:assets-js-french-pois-js-281:4ogrec","jurisdictionIds":["FR"],"legacy":{"compactRecord":{"access":["car","foot"],"cat":"village","co":"FR","dur":1.5,"e":630,"la":43.9811,"lo":5.5633,"n":"Simiane-la-Rotonde","region":"Alpes-de-Haute-Provence / Lure & Forcalquier","rs":"A Provençal hilltop village with a unique Romanesque circular keep — one of the finest 12th-century structures in the south, set in lavender country.","sc":7,"season":["spring","summer","autumn","winter"],"td":"A dramatic hilltop village crowned by a remarkable 12th-century Romanesque 'rotonde' — the circular domed keep of the Agoult castle, one of the best-preserved Romanesque rotundas in southern France.","themes":["historic","architecture","photogenic","hidden-gem","year-round"],"wl":"en","wt":"Simiane-la-Rotonde"},"ordinalId":"poi281","sourcePath":"assets/js/french-pois.js"},"names":[{"kind":"primary","language":"en","value":"Simiane-la-Rotonde"}],"notabilityScore":7,"originalSourceIds":[{"recordId":"french-pois.js#281","sourceId":"legacy-curated-pois"}],"quality":{"accessConfidence":0.18,"assessedAt":"2026-07-25","confidence":0.31,"flags":["discovery_lead","legacy_inventory","legacy_provenance_incomplete","sensitivity_not_assessed","unverified_migration_preview"],"freshness":"unknown","geometryConfidence":0.39,"notes":"Unverified migration/discovery preview; migrated without upgrading the evidence status of the legacy record. Unverified migration/discovery preview; not a verified production fact.","verificationStatus":"unverified"},"rationale":"A Provençal hilltop village with a unique Romanesque circular keep — one of the finest 12th-century structures in the south, set in lavender country.","schemaVersion":"1.0.0","seasons":["autumn","spring","summer","winter"],"sensitivity":{"action":"publish","reason":"Location was already public in the legacy application; sensitivity remains unassessed."},"sourceAssertions":[{"confidence":0.31,"evidenceKind":"maintainer_curated","fieldPath":"/","id":"legacy-place:assets-js-french-pois-js-281:4ogrec:source","notes":"Migrated from assets/js/french-pois.js; upstream provenance and licence need review.","observedAt":null,"retrievedAt":null,"sourceId":"legacy-curated-pois","sourceRecordId":"french-pois.js#281","validFrom":null,"validUntil":null,"verificationStatus":"unverified"},{"confidence":0.31,"evidenceKind":"maintainer_curated","fieldPath":"/geometry","id":"legacy-place:assets-js-french-pois-js-281:4ogrec:geometry","notes":"Migrated from assets/js/french-pois.js; upstream provenance and licence need review.","observedAt":null,"retrievedAt":null,"sourceId":"legacy-curated-pois","sourceRecordId":"french-pois.js#281","validFrom":null,"validUntil":null,"verificationStatus":"unverified"},{"confidence":0.31,"evidenceKind":"maintainer_curated","fieldPath":"/names","id":"legacy-place:assets-js-french-pois-js-281:4ogrec:names","notes":"Migrated from assets/js/french-pois.js; upstream provenance and licence need review.","observedAt":null,"retrievedAt":null,"sourceId":"legacy-curated-pois","sourceRecordId":"french-pois.js#281","validFrom":null,"validUntil":null,"verificationStatus":"unverified"}],"summary":"A dramatic hilltop village crowned by a remarkable 12th-century Romanesque 'rotonde' — the circular domed keep of the Agoult castle, one of the best-preserved Romanesque rotundas in southern France.","themes":["architecture","hidden-gem","historic","photogenic","year-round"],"typicalVisitMinutes":90}],"generated":true,"schemaVersion":"1.0.0","shardCount":1,"shardIndex":0,"x":131,"y":93,"zoom":8}
