{"artifactType":"nature-spatial-cell-package","cellId":"8/126/78","contentHash":"sha256:2a98e8fac4f53bb9cd348b8796db6fce5aa562ac1ec619ee43cd168060b13cb6","entities":[{"access":{"carStatus":null,"legal":"unknown","modes":["car","transit","foot"],"original":["car","bus","foot"]},"activities":["walking"],"classifications":[{"normalized":"castle_fortress","original":"castle-fortress","system":"itinera-legacy"}],"deliveryRegions":["uk-ireland"],"discovery":{"distinctiveness":0.9,"lane":"iconic","visitorProminence":1},"elevationMeters":50,"entityType":"Place","geometry":{"coordinates":[-2.1963,56.946],"type":"Point"},"id":"legacy-place:assets-js-uk-pois-js-1462:a4lwql","jurisdictionIds":["GB-SCT"],"legacy":{"compactRecord":{"access":["car","bus","foot"],"cat":"castle-fortress","co":"GB","dur":2,"e":50,"la":56.946,"lo":-2.1963,"n":"Dunnottar Castle","region":"Scotland / Aberdeenshire","rs":"One of Europe's most dramatically situated castles, approached across a narrow neck above crashing North Sea cliffs.","sc":9,"season":["spring","summer","autumn","winter"],"td":"Ruined fortress occupying an isolated sea stack south of Stonehaven.","themes":["historic","architecture","sea-cliff","photogenic","iconic","car-accessible"],"wl":"en","wt":"Dunnottar_Castle"},"ordinalId":"poi1462","sourcePath":"assets/js/uk-pois.js"},"names":[{"kind":"primary","language":"en","value":"Dunnottar Castle"}],"notabilityScore":9,"originalSourceIds":[{"recordId":"uk-pois.js#1462","sourceId":"legacy-curated-pois"}],"quality":{"accessConfidence":0.18,"assessedAt":"2026-07-25","confidence":0.31,"flags":["discovery_lead","legacy_inventory","legacy_provenance_incomplete","sensitivity_not_assessed","unverified_migration_preview"],"freshness":"unknown","geometryConfidence":0.39,"notes":"Unverified migration/discovery preview; migrated without upgrading the evidence status of the legacy record. Unverified migration/discovery preview; not a verified production fact.","verificationStatus":"unverified"},"rationale":"One of Europe's most dramatically situated castles, approached across a narrow neck above crashing North Sea cliffs.","schemaVersion":"1.0.0","seasons":["autumn","spring","summer","winter"],"sensitivity":{"action":"publish","reason":"Location was already public in the legacy application; sensitivity remains unassessed."},"sourceAssertions":[{"confidence":0.31,"evidenceKind":"maintainer_curated","fieldPath":"/","id":"legacy-place:assets-js-uk-pois-js-1462:a4lwql:source","notes":"Migrated from assets/js/uk-pois.js; upstream provenance and licence need review.","observedAt":null,"retrievedAt":null,"sourceId":"legacy-curated-pois","sourceRecordId":"uk-pois.js#1462","validFrom":null,"validUntil":null,"verificationStatus":"unverified"},{"confidence":0.31,"evidenceKind":"maintainer_curated","fieldPath":"/geometry","id":"legacy-place:assets-js-uk-pois-js-1462:a4lwql:geometry","notes":"Migrated from assets/js/uk-pois.js; upstream provenance and licence need review.","observedAt":null,"retrievedAt":null,"sourceId":"legacy-curated-pois","sourceRecordId":"uk-pois.js#1462","validFrom":null,"validUntil":null,"verificationStatus":"unverified"},{"confidence":0.31,"evidenceKind":"maintainer_curated","fieldPath":"/names","id":"legacy-place:assets-js-uk-pois-js-1462:a4lwql:names","notes":"Migrated from assets/js/uk-pois.js; upstream provenance and licence need review.","observedAt":null,"retrievedAt":null,"sourceId":"legacy-curated-pois","sourceRecordId":"uk-pois.js#1462","validFrom":null,"validUntil":null,"verificationStatus":"unverified"}],"summary":"Ruined fortress occupying an isolated sea stack south of Stonehaven.","themes":["architecture","car-accessible","historic","iconic","photogenic","sea-cliff"],"typicalVisitMinutes":120}],"generated":true,"schemaVersion":"1.0.0","shardCount":1,"shardIndex":0,"x":126,"y":78,"zoom":8}
