{"artifactType":"nature-spatial-cell-package","cellId":"8/227/95","contentHash":"sha256:1e3e205f0421b645d97f96479ded7bce257e972e6cc716b63a7bf226c1f650fe","entities":[{"access":{"carStatus":null,"legal":"unknown","modes":["transit","car"],"original":["bus","car"]},"activities":[],"classifications":[{"normalized":"castle_fortress","original":"castle-fortress","system":"itinera-legacy"}],"deliveryRegions":["japan"],"discovery":{"distinctiveness":0.8,"lane":"general"},"elevationMeters":40,"entityType":"Place","geometry":{"coordinates":[140.10839,41.42983],"type":"Point"},"id":"legacy-place:assets-js-japan-pois-js-1093:xngrtp","jurisdictionIds":["JP"],"legacy":{"compactRecord":{"access":["bus","car"],"cat":"castle-fortress","co":"JP","dur":3,"e":40,"la":41.42983,"lo":140.10839,"n":"Matsumae Castle & Park","region":"Hakodate","rs":"Matsumae Sakura Festival ~20 Apr–10 May; bus from Kikonai Stn (Hokkaidō Shinkansen) ~1 h 30. Combine with the Matsumae-han Yashiki samurai theme park.","sc":8,"season":["spring","summer","autumn"],"td":"Hokkaidō's only feudal castle, seat of the Matsumae clan that mediated Edo-era trade with the Ainu. The 1854 hirajiro tenshu burned 1949 and was rebuilt in concrete 1960; surrounded by 10 000 cherry trees of 250+ varieties – bloom rolls late Apr to m","themes":["cherry-blossom"],"wl":"en","wt":"Matsumae Castle"},"ordinalId":"poi1093","sourcePath":"assets/js/japan-pois.js"},"names":[{"kind":"primary","language":"en","value":"Matsumae Castle & Park"},{"kind":"alternate","language":"en","value":"Matsumae Castle"}],"notabilityScore":8,"originalSourceIds":[{"recordId":"japan-pois.js#1093","sourceId":"legacy-curated-pois"}],"quality":{"accessConfidence":0.18,"assessedAt":"2026-07-25","confidence":0.31,"flags":["discovery_lead","legacy_inventory","legacy_provenance_incomplete","sensitivity_not_assessed","unverified_migration_preview"],"freshness":"unknown","geometryConfidence":0.39,"notes":"Unverified migration/discovery preview; migrated without upgrading the evidence status of the legacy record. Unverified migration/discovery preview; not a verified production fact.","verificationStatus":"unverified"},"rationale":"Matsumae Sakura Festival ~20 Apr–10 May; bus from Kikonai Stn (Hokkaidō Shinkansen) ~1 h 30. Combine with the Matsumae-han Yashiki samurai theme park.","schemaVersion":"1.0.0","seasons":["autumn","spring","summer"],"sensitivity":{"action":"publish","reason":"Location was already public in the legacy application; sensitivity remains unassessed."},"sourceAssertions":[{"confidence":0.31,"evidenceKind":"maintainer_curated","fieldPath":"/","id":"legacy-place:assets-js-japan-pois-js-1093:xngrtp:source","notes":"Migrated from assets/js/japan-pois.js; upstream provenance and licence need review.","observedAt":null,"retrievedAt":null,"sourceId":"legacy-curated-pois","sourceRecordId":"japan-pois.js#1093","validFrom":null,"validUntil":null,"verificationStatus":"unverified"},{"confidence":0.31,"evidenceKind":"maintainer_curated","fieldPath":"/geometry","id":"legacy-place:assets-js-japan-pois-js-1093:xngrtp:geometry","notes":"Migrated from assets/js/japan-pois.js; upstream provenance and licence need review.","observedAt":null,"retrievedAt":null,"sourceId":"legacy-curated-pois","sourceRecordId":"japan-pois.js#1093","validFrom":null,"validUntil":null,"verificationStatus":"unverified"},{"confidence":0.31,"evidenceKind":"maintainer_curated","fieldPath":"/names","id":"legacy-place:assets-js-japan-pois-js-1093:xngrtp:names","notes":"Migrated from assets/js/japan-pois.js; upstream provenance and licence need review.","observedAt":null,"retrievedAt":null,"sourceId":"legacy-curated-pois","sourceRecordId":"japan-pois.js#1093","validFrom":null,"validUntil":null,"verificationStatus":"unverified"}],"summary":"Hokkaidō's only feudal castle, seat of the Matsumae clan that mediated Edo-era trade with the Ainu. The 1854 hirajiro tenshu burned 1949 and was rebuilt in concrete 1960; surrounded by 10 000 cherry trees of 250+ varieties – bloom rolls late Apr to m","themes":["cherry-blossom"],"typicalVisitMinutes":180}],"generated":true,"schemaVersion":"1.0.0","shardCount":1,"shardIndex":0,"x":227,"y":95,"zoom":8}
