{"artifactType":"nature-spatial-cell-package","cellId":"8/229/107","contentHash":"sha256:59f5cc405c3ffdde54b75a227f5a67de6403e6937774ca543ab007560c94abbc","entities":[{"access":{"carStatus":null,"legal":"unknown","modes":["car"],"original":["car"]},"activities":[],"classifications":[{"normalized":"national_park","original":"national-park","system":"itinera-legacy"}],"deliveryRegions":["japan"],"discovery":{"distinctiveness":0.8,"lane":"general"},"elevationMeters":0,"entityType":"ProtectedArea","geometry":{"coordinates":[142.19167,27.09444],"type":"Point"},"id":"legacy-place:assets-js-japan-pois-js-873:s4meex","jurisdictionIds":["JP"],"legacy":{"compactRecord":{"access":["car"],"cat":"national-park","co":"JP","dur":2,"e":null,"la":27.09444,"lo":142.19167,"n":"Chichijima (Ogasawara NP)","region":"Ogasawara","rs":"Main island of the Ogasawara/Bonin chain — UNESCO Natural Heritage 2011 for its endemic evolution ('Galápagos of the Orient'). Humpback whale watching Feb–Apr, dolphin swims, white-sand John Beach (Jo","sc":8,"season":["spring","summer","autumn","winter"],"td":"Main island of the Ogasawara/Bonin chain — UNESCO Natural Heritage 2011 for its endemic evolution ('Galápagos of the Orient'). Humpback whale watching Feb–Apr, dolphin swims, white-sand John Beach (Jonī-bīchi) hike. Access only via the 24-hour Ogasaw","themes":[],"wl":"en","wt":"Chichijima"},"ordinalId":"poi873","sourcePath":"assets/js/japan-pois.js"},"names":[{"kind":"primary","language":"en","value":"Chichijima (Ogasawara NP)"},{"kind":"alternate","language":"en","value":"Chichijima"}],"notabilityScore":8,"originalSourceIds":[{"recordId":"japan-pois.js#873","sourceId":"legacy-curated-pois"}],"quality":{"accessConfidence":0.18,"assessedAt":"2026-07-25","confidence":0.31,"flags":["discovery_lead","legacy_inventory","legacy_provenance_incomplete","sensitivity_not_assessed","unverified_migration_preview"],"freshness":"unknown","geometryConfidence":0.39,"notes":"Unverified migration/discovery preview; migrated without upgrading the evidence status of the legacy record. Unverified migration/discovery preview; not a verified production fact.","verificationStatus":"unverified"},"rationale":"Main island of the Ogasawara/Bonin chain — UNESCO Natural Heritage 2011 for its endemic evolution ('Galápagos of the Orient'). Humpback whale watching Feb–Apr, dolphin swims, white-sand John Beach (Jo","schemaVersion":"1.0.0","seasons":["autumn","spring","summer","winter"],"sensitivity":{"action":"publish","reason":"Location was already public in the legacy application; sensitivity remains unassessed."},"sourceAssertions":[{"confidence":0.31,"evidenceKind":"maintainer_curated","fieldPath":"/","id":"legacy-place:assets-js-japan-pois-js-873:s4meex:source","notes":"Migrated from assets/js/japan-pois.js; upstream provenance and licence need review.","observedAt":null,"retrievedAt":null,"sourceId":"legacy-curated-pois","sourceRecordId":"japan-pois.js#873","validFrom":null,"validUntil":null,"verificationStatus":"unverified"},{"confidence":0.31,"evidenceKind":"maintainer_curated","fieldPath":"/geometry","id":"legacy-place:assets-js-japan-pois-js-873:s4meex:geometry","notes":"Migrated from assets/js/japan-pois.js; upstream provenance and licence need review.","observedAt":null,"retrievedAt":null,"sourceId":"legacy-curated-pois","sourceRecordId":"japan-pois.js#873","validFrom":null,"validUntil":null,"verificationStatus":"unverified"},{"confidence":0.31,"evidenceKind":"maintainer_curated","fieldPath":"/names","id":"legacy-place:assets-js-japan-pois-js-873:s4meex:names","notes":"Migrated from assets/js/japan-pois.js; upstream provenance and licence need review.","observedAt":null,"retrievedAt":null,"sourceId":"legacy-curated-pois","sourceRecordId":"japan-pois.js#873","validFrom":null,"validUntil":null,"verificationStatus":"unverified"}],"summary":"Main island of the Ogasawara/Bonin chain — UNESCO Natural Heritage 2011 for its endemic evolution ('Galápagos of the Orient'). Humpback whale watching Feb–Apr, dolphin swims, white-sand John Beach (Jonī-bīchi) hike. Access only via the 24-hour Ogasaw","themes":[],"typicalVisitMinutes":120}],"generated":true,"schemaVersion":"1.0.0","shardCount":1,"shardIndex":0,"x":229,"y":107,"zoom":8}
