{"artifactType":"nature-spatial-cell-package","cellId":"8/123/76","contentHash":"sha256:1073568cd07cdbef71aca06ccee513a83b8b9a59542104ae410f372df5717df2","entities":[{"access":{"legal":"unknown","modes":["car"]},"activities":["scenic_driving"],"classifications":[{"normalized":"scenic_drive","original":"scenic-drive","system":"itinera-legacy"}],"deliveryRegions":["uk-ireland"],"direction":"both","discovery":{"distinctiveness":0.96,"lane":"iconic","visitorProminence":1},"entityType":"TrailRoute","geometry":{"coordinates":[[-4.2247,57.4778],[-5.6963,57.4184],[-5.8097,57.4327],[-5.16,57.8953],[-4.746,58.5685],[-3.376,58.6719],[-3.068,58.6438],[-4.0288,57.8805],[-4.2247,57.4778]],"type":"LineString"},"geometryCompleteness":"overview_only","id":"legacy-scenic-drive:assets-js-uk-ireland-scenic-drives-js-11:1tsjiye","journeyShape":"loop","jurisdictionIds":["GB-SCT"],"legacy":{"compactRecord":{"co":"GB","drive_min":900,"kind":"scenic-drive","len_km":830,"n":"North Coast 500","region":"Scotland / Northern Highlands","rs":"Scotland's signature road trip: Atlantic mountains and beaches on the west, vast northern horizons, archaeology and castles on the east.","sc":9.6,"season":["spring","summer","autumn","winter"],"td":"Long-distance loop from Inverness around Scotland's far north, joining Applecross, Wester Ross, Sutherland and Caithness on often narrow single-track roads.","themes":["iconic","panoramic-view","photogenic","car-accessible","coastal","remote"],"waypoints":[{"la":57.4778,"lo":-4.2247,"n":"Inverness"},{"la":57.4184,"lo":-5.6963,"n":"Bealach na Bà"},{"la":57.4327,"lo":-5.8097,"n":"Applecross"},{"la":57.8953,"lo":-5.16,"n":"Ullapool"},{"la":58.5685,"lo":-4.746,"n":"Durness"},{"la":58.6719,"lo":-3.376,"n":"Dunnet Head"},{"la":58.6438,"lo":-3.068,"n":"John o' Groats"},{"la":57.8805,"lo":-4.0288,"n":"Dornoch"},{"la":57.4778,"lo":-4.2247,"n":"Inverness"}],"wl":"en","wt":"North_Coast_500"},"ordinalId":"scenic-drive-11","sourcePath":"assets/js/uk-ireland-scenic-drives.js"},"metrics":{"distanceMeters":830000,"typicalDurationMinutes":900},"names":[{"kind":"primary","language":"en","value":"North Coast 500"}],"navigationSuitability":false,"originalSourceIds":[{"recordId":"uk-ireland-scenic-drives.js#11","sourceId":"legacy-scenic-drives"}],"quality":{"accessConfidence":0.18,"assessedAt":"2026-07-25","confidence":0.34,"flags":["discovery_lead","legacy_inventory","legacy_provenance_incomplete","overview_geometry_only","unverified_migration_preview"],"freshness":"unknown","geometryConfidence":0.42000000000000004,"notes":"Unverified migration/discovery preview; migrated without upgrading the evidence status of the legacy record. Unverified migration/discovery preview; not a verified production fact.","verificationStatus":"unverified"},"rationale":"Scotland's signature road trip: Atlantic mountains and beaches on the west, vast northern horizons, archaeology and castles on the east.","routeNature":"scenic_drive","schemaVersion":"1.0.0","seasons":["autumn","spring","summer","winter"],"sensitivity":{"action":"publish","reason":"Location was already public in the legacy application; sensitivity remains unassessed."},"sourceAssertions":[{"confidence":0.34,"evidenceKind":"maintainer_curated","fieldPath":"/","id":"legacy-scenic-drive:assets-js-uk-ireland-scenic-drives-js-11:1tsjiye:source","notes":"Migrated from assets/js/uk-ireland-scenic-drives.js; upstream provenance and licence need review.","observedAt":null,"retrievedAt":null,"sourceId":"legacy-scenic-drives","sourceRecordId":"uk-ireland-scenic-drives.js#11","validFrom":null,"validUntil":null,"verificationStatus":"unverified"},{"confidence":0.34,"evidenceKind":"maintainer_curated","fieldPath":"/geometry","id":"legacy-scenic-drive:assets-js-uk-ireland-scenic-drives-js-11:1tsjiye:geometry","notes":"Migrated from assets/js/uk-ireland-scenic-drives.js; upstream provenance and licence need review.","observedAt":null,"retrievedAt":null,"sourceId":"legacy-scenic-drives","sourceRecordId":"uk-ireland-scenic-drives.js#11","validFrom":null,"validUntil":null,"verificationStatus":"unverified"},{"confidence":0.34,"evidenceKind":"maintainer_curated","fieldPath":"/names","id":"legacy-scenic-drive:assets-js-uk-ireland-scenic-drives-js-11:1tsjiye:names","notes":"Migrated from assets/js/uk-ireland-scenic-drives.js; upstream provenance and licence need review.","observedAt":null,"retrievedAt":null,"sourceId":"legacy-scenic-drives","sourceRecordId":"uk-ireland-scenic-drives.js#11","validFrom":null,"validUntil":null,"verificationStatus":"unverified"}],"summary":"Long-distance loop from Inverness around Scotland's far north, joining Applecross, Wester Ross, Sutherland and Caithness on often narrow single-track roads.","themes":["car-accessible","coastal","iconic","panoramic-view","photogenic","remote"]}],"generated":true,"schemaVersion":"1.0.0","shardCount":1,"shardIndex":0,"x":123,"y":76,"zoom":8}
