{"artifactType":"nature-spatial-cell-package","cellId":"8/228/99","contentHash":"sha256:7cba891e6439ba5b276c445680a6bb1bc879a757fdecd648e576a48f4c122431","entities":[{"access":{"carStatus":null,"legal":"unknown","modes":["transit"],"original":["train","bus"]},"activities":[],"classifications":[{"normalized":"museum_cultural","original":"museum-cultural","system":"itinera-legacy"}],"deliveryRegions":["japan"],"discovery":{"distinctiveness":0.6,"lane":"general"},"elevationMeters":10,"entityType":"Place","geometry":{"coordinates":[141.02472,37.45389],"type":"Point"},"id":"legacy-place:assets-js-japan-pois-js-814:l9gsgy","jurisdictionIds":["JP","JP-07"],"legacy":{"compactRecord":{"access":["train","bus"],"cat":"museum-cultural","co":"JP","dur":2,"e":10,"la":37.45389,"lo":141.02472,"n":"Great East Japan Earthquake & Nuclear Disaster Memorial Museum","region":"Fukushima","rs":"Opened 2020 in Futaba, just outside the still-restricted Fukushima Daiichi zone, this prefectural museum documents the 11 March 2011 tsunami, the reactor meltdowns and the ongoing decommissioning and ","sc":6,"season":["spring","summer","autumn","winter"],"td":"Opened 2020 in Futaba, just outside the still-restricted Fukushima Daiichi zone, this prefectural museum documents the 11 March 2011 tsunami, the reactor meltdowns and the ongoing decommissioning and resettlement effort. Testimonies from evacuees and","themes":["historic","special-experience"],"wl":"ja","wt":"東日本大震災・原子力災害伝承館"},"ordinalId":"poi814","sourcePath":"assets/js/japan-pois.js"},"names":[{"kind":"primary","language":"ja","value":"Great East Japan Earthquake & Nuclear Disaster Memorial Museum"},{"kind":"official","language":"ja","value":"東日本大震災・原子力災害伝承館"}],"notabilityScore":6,"originalSourceIds":[{"recordId":"japan-pois.js#814","sourceId":"legacy-curated-pois"}],"quality":{"accessConfidence":0.18,"assessedAt":"2026-07-25","confidence":0.31,"flags":["discovery_lead","legacy_inventory","legacy_provenance_incomplete","sensitivity_not_assessed","unverified_migration_preview"],"freshness":"unknown","geometryConfidence":0.39,"notes":"Unverified migration/discovery preview; migrated without upgrading the evidence status of the legacy record. Unverified migration/discovery preview; not a verified production fact.","verificationStatus":"unverified"},"rationale":"Opened 2020 in Futaba, just outside the still-restricted Fukushima Daiichi zone, this prefectural museum documents the 11 March 2011 tsunami, the reactor meltdowns and the ongoing decommissioning and","schemaVersion":"1.0.0","seasons":["autumn","spring","summer","winter"],"sensitivity":{"action":"publish","reason":"Location was already public in the legacy application; sensitivity remains unassessed."},"sourceAssertions":[{"confidence":0.31,"evidenceKind":"maintainer_curated","fieldPath":"/","id":"legacy-place:assets-js-japan-pois-js-814:l9gsgy:source","notes":"Migrated from assets/js/japan-pois.js; upstream provenance and licence need review.","observedAt":null,"retrievedAt":null,"sourceId":"legacy-curated-pois","sourceRecordId":"japan-pois.js#814","validFrom":null,"validUntil":null,"verificationStatus":"unverified"},{"confidence":0.31,"evidenceKind":"maintainer_curated","fieldPath":"/geometry","id":"legacy-place:assets-js-japan-pois-js-814:l9gsgy:geometry","notes":"Migrated from assets/js/japan-pois.js; upstream provenance and licence need review.","observedAt":null,"retrievedAt":null,"sourceId":"legacy-curated-pois","sourceRecordId":"japan-pois.js#814","validFrom":null,"validUntil":null,"verificationStatus":"unverified"},{"confidence":0.31,"evidenceKind":"maintainer_curated","fieldPath":"/names","id":"legacy-place:assets-js-japan-pois-js-814:l9gsgy:names","notes":"Migrated from assets/js/japan-pois.js; upstream provenance and licence need review.","observedAt":null,"retrievedAt":null,"sourceId":"legacy-curated-pois","sourceRecordId":"japan-pois.js#814","validFrom":null,"validUntil":null,"verificationStatus":"unverified"}],"summary":"Opened 2020 in Futaba, just outside the still-restricted Fukushima Daiichi zone, this prefectural museum documents the 11 March 2011 tsunami, the reactor meltdowns and the ongoing decommissioning and resettlement effort. Testimonies from evacuees and","themes":["historic","special-experience"],"typicalVisitMinutes":120}],"generated":true,"schemaVersion":"1.0.0","shardCount":1,"shardIndex":0,"x":228,"y":99,"zoom":8}
