{"artifactType":"nature-spatial-cell-package","cellId":"8/121/77","contentHash":"sha256:d15057d77bed394b8cd5d5017218e5d04ddd3927abc3e3bed4b15fcaf5f39451","entities":[{"access":{"carStatus":null,"legal":"unknown","modes":["ferry","foot"],"original":["boat","foot"]},"activities":["walking"],"classifications":[{"normalized":"special_experience","original":"special-experience","system":"itinera-legacy"}],"deliveryRegions":["uk-ireland"],"discovery":{"distinctiveness":1,"lane":"general"},"elevationMeters":430,"entityType":"Place","geometry":{"coordinates":[-8.5853,57.8146],"type":"Point"},"id":"legacy-place:assets-js-uk-pois-js-1465:1fy47p3","jurisdictionIds":["GB-SCT"],"legacy":{"compactRecord":{"access":["boat","foot"],"cat":"special-experience","co":"GB","dur":8,"e":430,"la":57.8146,"lo":-8.5853,"n":"St Kilda","region":"Scotland / Outer Hebrides","rs":"Britain's most isolated cultural and natural World Heritage landscape; access itself is an expedition.","sc":10,"season":["spring","summer","autumn"],"td":"Remote Atlantic archipelago with Europe's highest sea cliffs, enormous seabird colonies and the remains of an evacuated island community.","themes":["unesco","island","wildlife","remote","boat-accessible","historic"],"wl":"en","wt":"St_Kilda,_Scotland"},"ordinalId":"poi1465","sourcePath":"assets/js/uk-pois.js"},"names":[{"kind":"primary","language":"en","value":"St Kilda"},{"kind":"alternate","language":"en","value":"St_Kilda,_Scotland"}],"notabilityScore":10,"originalSourceIds":[{"recordId":"uk-pois.js#1465","sourceId":"legacy-curated-pois"}],"quality":{"accessConfidence":0.18,"assessedAt":"2026-07-25","confidence":0.31,"flags":["discovery_lead","legacy_inventory","legacy_provenance_incomplete","sensitivity_not_assessed","unverified_migration_preview"],"freshness":"unknown","geometryConfidence":0.39,"notes":"Unverified migration/discovery preview; migrated without upgrading the evidence status of the legacy record. Unverified migration/discovery preview; not a verified production fact.","verificationStatus":"unverified"},"rationale":"Britain's most isolated cultural and natural World Heritage landscape; access itself is an expedition.","schemaVersion":"1.0.0","seasons":["autumn","spring","summer"],"sensitivity":{"action":"publish","reason":"Location was already public in the legacy application; sensitivity remains unassessed."},"sourceAssertions":[{"confidence":0.31,"evidenceKind":"maintainer_curated","fieldPath":"/","id":"legacy-place:assets-js-uk-pois-js-1465:1fy47p3:source","notes":"Migrated from assets/js/uk-pois.js; upstream provenance and licence need review.","observedAt":null,"retrievedAt":null,"sourceId":"legacy-curated-pois","sourceRecordId":"uk-pois.js#1465","validFrom":null,"validUntil":null,"verificationStatus":"unverified"},{"confidence":0.31,"evidenceKind":"maintainer_curated","fieldPath":"/geometry","id":"legacy-place:assets-js-uk-pois-js-1465:1fy47p3:geometry","notes":"Migrated from assets/js/uk-pois.js; upstream provenance and licence need review.","observedAt":null,"retrievedAt":null,"sourceId":"legacy-curated-pois","sourceRecordId":"uk-pois.js#1465","validFrom":null,"validUntil":null,"verificationStatus":"unverified"},{"confidence":0.31,"evidenceKind":"maintainer_curated","fieldPath":"/names","id":"legacy-place:assets-js-uk-pois-js-1465:1fy47p3:names","notes":"Migrated from assets/js/uk-pois.js; upstream provenance and licence need review.","observedAt":null,"retrievedAt":null,"sourceId":"legacy-curated-pois","sourceRecordId":"uk-pois.js#1465","validFrom":null,"validUntil":null,"verificationStatus":"unverified"}],"summary":"Remote Atlantic archipelago with Europe's highest sea cliffs, enormous seabird colonies and the remains of an evacuated island community.","themes":["boat-accessible","historic","island","remote","unesco","wildlife"],"typicalVisitMinutes":480}],"generated":true,"schemaVersion":"1.0.0","shardCount":1,"shardIndex":0,"x":121,"y":77,"zoom":8}
