{"artifactType":"nature-spatial-cell-package","cellId":"8/135/88","contentHash":"sha256:c0e3637918d241bcb8c439961560a3bc7a199a37c29275c5cc63cf4e61735ac6","entities":[{"accessModes":["car"],"deliveryRegions":["eu-alps"],"entityType":"AccessPoint","geometry":{"coordinates":[9.93129,48.78525],"type":"Point"},"id":"legacy-access:legacy-pass-assets-js-passes-data-js-574-1llxq3u-a:kaupmu","jurisdictionIds":["ALPS"],"legalAccess":"unknown","linkedEntityIds":["legacy-pass:assets-js-passes-data-js-574:1llxq3u"],"names":[{"kind":"primary","language":"de","value":"Furtlepass A gateway"}],"originalSourceIds":[{"recordId":"passes-data.js#574:gateway-A","sourceId":"legacy-alps-osm"}],"parking":{"closesLocal":null,"fee":null,"opensLocal":null,"spaces":null,"stoppingAllowed":null},"quality":{"accessConfidence":0.18,"assessedAt":"2026-07-25","confidence":0.34,"flags":["discovery_lead","legacy_inventory","legal_access_unknown","stopping_permission_unknown","unverified_migration_preview"],"freshness":"unknown","geometryConfidence":0.42000000000000004,"notes":"Unverified migration/discovery preview; migrated without upgrading the evidence status of the legacy record. Unverified migration/discovery preview; not a verified production fact.","verificationStatus":"unverified"},"schemaVersion":"1.0.0","sensitivity":{"action":"publish","reason":"Location was already public in the legacy application; sensitivity remains unassessed."},"sourceAssertions":[{"confidence":0.34,"evidenceKind":"maintainer_curated","fieldPath":"/","id":"legacy-access:legacy-pass-assets-js-passes-data-js-574-1llxq3u-a:kaupmu:source","notes":"Migrated from assets/js/passes-data.js; upstream provenance and licence need review.","observedAt":null,"retrievedAt":null,"sourceId":"legacy-alps-osm","sourceRecordId":"passes-data.js#574:gateway-A","validFrom":null,"validUntil":null,"verificationStatus":"unverified"},{"confidence":0.34,"evidenceKind":"maintainer_curated","fieldPath":"/geometry","id":"legacy-access:legacy-pass-assets-js-passes-data-js-574-1llxq3u-a:kaupmu:geometry","notes":"Migrated from assets/js/passes-data.js; upstream provenance and licence need review.","observedAt":null,"retrievedAt":null,"sourceId":"legacy-alps-osm","sourceRecordId":"passes-data.js#574:gateway-A","validFrom":null,"validUntil":null,"verificationStatus":"unverified"},{"confidence":0.34,"evidenceKind":"maintainer_curated","fieldPath":"/names","id":"legacy-access:legacy-pass-assets-js-passes-data-js-574-1llxq3u-a:kaupmu:names","notes":"Migrated from assets/js/passes-data.js; upstream provenance and licence need review.","observedAt":null,"retrievedAt":null,"sourceId":"legacy-alps-osm","sourceRecordId":"passes-data.js#574:gateway-A","validFrom":null,"validUntil":null,"verificationStatus":"unverified"}]},{"access":{"legal":"unknown","modes":["car"]},"accessPointIds":["legacy-access:legacy-pass-assets-js-passes-data-js-574-1llxq3u-a:kaupmu","legacy-access:legacy-pass-assets-js-passes-data-js-574-1llxq3u-b:9r6nrx"],"activities":["scenic_driving"],"classifications":[{"normalized":"mountain_pass","original":"mountain-pass","system":"itinera-legacy"}],"deliveryRegions":["eu-alps"],"discovery":{"distinctiveness":0.031,"lane":"general"},"elevationMeters":632,"entityType":"NaturalFeature","geometry":{"coordinates":[9.87161,48.74832],"type":"Point"},"id":"legacy-pass:assets-js-passes-data-js-574:1llxq3u","jurisdictionIds":["ALPS"],"legacy":{"compactRecord":{"bA":[48.78525,9.93129],"bB":[48.7057,9.82145],"bp":"https://upload.wikimedia.org/wikipedia/commons/9/96/Furtlepass.jpg?utm_source=commons.wikimedia.org&utm_campaign=imageinfo&utm_content=thumbnail_unscaled","cf":"m","e":632,"la":48.74832,"lo":9.87161,"n":"Furtlepass","qAp":0.35,"qSm":0.25,"rs":"A low (630 m) saddle in the Swabian Alb foothills; pleasant pastoral scenery and an adjacent gliding airfield add mild interest, but the simple state road has no hairpins, no dramatic gradients, and virtually no fame outside the Schwäbisch Gmünd area.","sc":0.31,"sg":{"dE":3,"pp":2,"sB":4,"sI":2.5},"td":"Furtlepass is a gentle 630 m saddle on Baden-Württemberg's L1160, crossing the Rems–Fils watershed on the Swabian Alb plateau. It offers peaceful forested countryside, a gliding airfield, hiking trails, and local cycling-marathon fame, but lacks dramatic alpine character.","ts":"agent","wl":"de","wt":"Furtlepass"},"ordinalId":"p574","sourcePath":"assets/js/passes-data.js"},"names":[{"kind":"primary","language":"de","value":"Furtlepass"}],"originalSourceIds":[{"recordId":"passes-data.js#574","sourceId":"legacy-alps-osm"}],"quality":{"accessConfidence":0.18,"assessedAt":"2026-07-25","confidence":0.38,"flags":["discovery_lead","legacy_inventory","legacy_provenance_incomplete","point_representation","sensitivity_not_assessed","unverified_migration_preview"],"freshness":"unknown","geometryConfidence":0.46,"notes":"Unverified migration/discovery preview; migrated without upgrading the evidence status of the legacy record. Unverified migration/discovery preview; not a verified production fact.","verificationStatus":"unverified"},"rationale":"A low (630 m) saddle in the Swabian Alb foothills; pleasant pastoral scenery and an adjacent gliding airfield add mild interest, but the simple state road has no hairpins, no dramatic gradients, and virtually no fame outside the Schwäbisch Gmünd area.","schemaVersion":"1.0.0","sensitivity":{"action":"publish","reason":"Location was already public in the legacy application; sensitivity remains unassessed."},"sourceAssertions":[{"confidence":0.38,"evidenceKind":"maintainer_curated","fieldPath":"/","id":"legacy-pass:assets-js-passes-data-js-574:1llxq3u:source","notes":"Migrated from assets/js/passes-data.js; upstream provenance and licence need review.","observedAt":null,"retrievedAt":null,"sourceId":"legacy-alps-osm","sourceRecordId":"passes-data.js#574","validFrom":null,"validUntil":null,"verificationStatus":"unverified"},{"confidence":0.38,"evidenceKind":"maintainer_curated","fieldPath":"/geometry","id":"legacy-pass:assets-js-passes-data-js-574:1llxq3u:geometry","notes":"Migrated from assets/js/passes-data.js; upstream provenance and licence need review.","observedAt":null,"retrievedAt":null,"sourceId":"legacy-alps-osm","sourceRecordId":"passes-data.js#574","validFrom":null,"validUntil":null,"verificationStatus":"unverified"},{"confidence":0.38,"evidenceKind":"maintainer_curated","fieldPath":"/names","id":"legacy-pass:assets-js-passes-data-js-574:1llxq3u:names","notes":"Migrated from assets/js/passes-data.js; upstream provenance and licence need review.","observedAt":null,"retrievedAt":null,"sourceId":"legacy-alps-osm","sourceRecordId":"passes-data.js#574","validFrom":null,"validUntil":null,"verificationStatus":"unverified"}],"summary":"Furtlepass is a gentle 630 m saddle on Baden-Württemberg's L1160, crossing the Rems–Fils watershed on the Swabian Alb plateau. It offers peaceful forested countryside, a gliding airfield, hiking trails, and local cycling-marathon fame, but lacks dramatic alpine character."}],"generated":true,"schemaVersion":"1.0.0","shardCount":1,"shardIndex":0,"x":135,"y":88,"zoom":8}
