{"artifactType":"nature-spatial-cell-package","cellId":"8/230/92","contentHash":"sha256:697920898c76832a467d0ac04d0f6fdcfab69ba21b3db997a8be21495ef9e851","entities":[{"access":{"carStatus":null,"legal":"unknown","modes":["car"],"original":["car"]},"activities":[],"classifications":[{"normalized":"alpine_lake","original":"alpine-lake","system":"itinera-legacy"}],"deliveryRegions":["japan"],"discovery":{"distinctiveness":0.7,"lane":"quieter_lead","visitorProminence":0},"elevationMeters":0,"entityType":"NaturalFeature","geometry":{"coordinates":[143.717,44.167],"type":"Point"},"id":"legacy-place:assets-js-japan-pois-js-745:fj8gel","jurisdictionIds":["JP"],"legacy":{"compactRecord":{"access":["car"],"cat":"alpine-lake","co":"JP","dur":2,"e":0,"la":44.167,"lo":143.717,"n":"Lake Saroma","region":"Abashiri-Mombetsu","rs":"Japan's largest brackish lagoon — sunsets across an oyster-farming lake the size of a sea; quietest big lake in Hokkaidō.","sc":7,"season":["spring","summer","autumn","winter"],"td":"Japan's third-largest lake (150 km²) — a 25 km coastal lagoon separated from the Sea of Okhotsk by a sandbar. Famed for scallop & oyster farming and sunsets from the three Saroma view-hills. Ramsar wetland.","themes":["photogenic","hidden-gem","car-accessible","autumn-foliage","food-drink","panoramic-view"],"wl":"en","wt":"Lake Saroma"},"ordinalId":"poi745","sourcePath":"assets/js/japan-pois.js"},"names":[{"kind":"primary","language":"en","value":"Lake Saroma"}],"notabilityScore":7,"originalSourceIds":[{"recordId":"japan-pois.js#745","sourceId":"legacy-curated-pois"}],"quality":{"accessConfidence":0.18,"assessedAt":"2026-07-25","confidence":0.31,"flags":["discovery_lead","legacy_inventory","legacy_provenance_incomplete","sensitivity_not_assessed","unverified_migration_preview"],"freshness":"unknown","geometryConfidence":0.39,"notes":"Unverified migration/discovery preview; migrated without upgrading the evidence status of the legacy record. Unverified migration/discovery preview; not a verified production fact.","verificationStatus":"unverified"},"rationale":"Japan's largest brackish lagoon — sunsets across an oyster-farming lake the size of a sea; quietest big lake in Hokkaidō.","schemaVersion":"1.0.0","seasons":["autumn","spring","summer","winter"],"sensitivity":{"action":"publish","reason":"Location was already public in the legacy application; sensitivity remains unassessed."},"sourceAssertions":[{"confidence":0.31,"evidenceKind":"maintainer_curated","fieldPath":"/","id":"legacy-place:assets-js-japan-pois-js-745:fj8gel:source","notes":"Migrated from assets/js/japan-pois.js; upstream provenance and licence need review.","observedAt":null,"retrievedAt":null,"sourceId":"legacy-curated-pois","sourceRecordId":"japan-pois.js#745","validFrom":null,"validUntil":null,"verificationStatus":"unverified"},{"confidence":0.31,"evidenceKind":"maintainer_curated","fieldPath":"/geometry","id":"legacy-place:assets-js-japan-pois-js-745:fj8gel:geometry","notes":"Migrated from assets/js/japan-pois.js; upstream provenance and licence need review.","observedAt":null,"retrievedAt":null,"sourceId":"legacy-curated-pois","sourceRecordId":"japan-pois.js#745","validFrom":null,"validUntil":null,"verificationStatus":"unverified"},{"confidence":0.31,"evidenceKind":"maintainer_curated","fieldPath":"/names","id":"legacy-place:assets-js-japan-pois-js-745:fj8gel:names","notes":"Migrated from assets/js/japan-pois.js; upstream provenance and licence need review.","observedAt":null,"retrievedAt":null,"sourceId":"legacy-curated-pois","sourceRecordId":"japan-pois.js#745","validFrom":null,"validUntil":null,"verificationStatus":"unverified"}],"summary":"Japan's third-largest lake (150 km²) — a 25 km coastal lagoon separated from the Sea of Okhotsk by a sandbar. Famed for scallop & oyster farming and sunsets from the three Saroma view-hills. Ramsar wetland.","themes":["autumn-foliage","car-accessible","food-drink","hidden-gem","panoramic-view","photogenic"],"typicalVisitMinutes":120}],"generated":true,"schemaVersion":"1.0.0","shardCount":1,"shardIndex":0,"x":230,"y":92,"zoom":8}
