{"artifactType":"nature-spatial-cell-package","cellId":"8/227/102","contentHash":"sha256:75b2ec99ca9294cdd372571919a601affd4fc6ff1004adcc563fa715d938425c","entities":[{"access":{"carStatus":null,"legal":"unknown","modes":["car"],"original":["car"]},"activities":[],"classifications":[{"normalized":"volcano","original":"volcano","system":"itinera-legacy"}],"deliveryRegions":["japan"],"discovery":{"distinctiveness":0.7,"lane":"general"},"elevationMeters":0,"entityType":"NaturalFeature","geometry":{"coordinates":[139.7625,33.13833],"type":"Point"},"id":"legacy-place:assets-js-japan-pois-js-870:g5i9je","jurisdictionIds":["JP"],"legacy":{"compactRecord":{"access":["car"],"cat":"volcano","co":"JP","dur":2,"e":null,"la":33.13833,"lo":139.7625,"n":"Mt Hachijō-Fuji","region":"Izu Islands","rs":"854 m symmetric stratovolcano on Hachijōjima — last erupted 1605. Stone-step path from the 7th-station car park reaches the crater rim in ~1 hr; a full rim circuit (お鉢巡り) takes ~1.5 hrs with views to ","sc":7,"season":["spring","summer","autumn","winter"],"td":"854 m symmetric stratovolcano on Hachijōjima — last erupted 1605. Stone-step path from the 7th-station car park reaches the crater rim in ~1 hr; a full rim circuit (お鉢巡り) takes ~1.5 hrs with views to Hachijō-kojima.","themes":[],"wl":"en","wt":"Hachijō-fuji"},"ordinalId":"poi870","sourcePath":"assets/js/japan-pois.js"},"names":[{"kind":"primary","language":"en","value":"Mt Hachijō-Fuji"},{"kind":"alternate","language":"en","value":"Hachijō-fuji"}],"notabilityScore":7,"originalSourceIds":[{"recordId":"japan-pois.js#870","sourceId":"legacy-curated-pois"}],"quality":{"accessConfidence":0.18,"assessedAt":"2026-07-25","confidence":0.31,"flags":["discovery_lead","legacy_inventory","legacy_provenance_incomplete","sensitivity_not_assessed","unverified_migration_preview"],"freshness":"unknown","geometryConfidence":0.39,"notes":"Unverified migration/discovery preview; migrated without upgrading the evidence status of the legacy record. Unverified migration/discovery preview; not a verified production fact.","verificationStatus":"unverified"},"rationale":"854 m symmetric stratovolcano on Hachijōjima — last erupted 1605. Stone-step path from the 7th-station car park reaches the crater rim in ~1 hr; a full rim circuit (お鉢巡り) takes ~1.5 hrs with views to","schemaVersion":"1.0.0","seasons":["autumn","spring","summer","winter"],"sensitivity":{"action":"publish","reason":"Location was already public in the legacy application; sensitivity remains unassessed."},"sourceAssertions":[{"confidence":0.31,"evidenceKind":"maintainer_curated","fieldPath":"/","id":"legacy-place:assets-js-japan-pois-js-870:g5i9je:source","notes":"Migrated from assets/js/japan-pois.js; upstream provenance and licence need review.","observedAt":null,"retrievedAt":null,"sourceId":"legacy-curated-pois","sourceRecordId":"japan-pois.js#870","validFrom":null,"validUntil":null,"verificationStatus":"unverified"},{"confidence":0.31,"evidenceKind":"maintainer_curated","fieldPath":"/geometry","id":"legacy-place:assets-js-japan-pois-js-870:g5i9je:geometry","notes":"Migrated from assets/js/japan-pois.js; upstream provenance and licence need review.","observedAt":null,"retrievedAt":null,"sourceId":"legacy-curated-pois","sourceRecordId":"japan-pois.js#870","validFrom":null,"validUntil":null,"verificationStatus":"unverified"},{"confidence":0.31,"evidenceKind":"maintainer_curated","fieldPath":"/names","id":"legacy-place:assets-js-japan-pois-js-870:g5i9je:names","notes":"Migrated from assets/js/japan-pois.js; upstream provenance and licence need review.","observedAt":null,"retrievedAt":null,"sourceId":"legacy-curated-pois","sourceRecordId":"japan-pois.js#870","validFrom":null,"validUntil":null,"verificationStatus":"unverified"}],"summary":"854 m symmetric stratovolcano on Hachijōjima — last erupted 1605. Stone-step path from the 7th-station car park reaches the crater rim in ~1 hr; a full rim circuit (お鉢巡り) takes ~1.5 hrs with views to Hachijō-kojima.","themes":[],"typicalVisitMinutes":120},{"access":{"carStatus":null,"legal":"unknown","modes":["car"],"original":["car"]},"activities":[],"classifications":[{"normalized":"special_experience","original":"special-experience","system":"itinera-legacy"}],"deliveryRegions":["japan"],"discovery":{"distinctiveness":0.8,"lane":"general"},"elevationMeters":0,"entityType":"Place","geometry":{"coordinates":[139.605,33.87111],"type":"Point"},"id":"legacy-place:assets-js-japan-pois-js-875:1vwquvb","jurisdictionIds":["JP"],"legacy":{"compactRecord":{"access":["car"],"cat":"special-experience","co":"JP","dur":2,"e":null,"la":33.87111,"lo":139.605,"n":"Mikurajima Dolphin Swim","region":"Izu Islands","rs":"Tiny island (~300 residents) hosting a resident pod of ~150 Indo-Pacific bottlenose dolphins. Snorkel swims operate Apr–Nov under a strict village permit system: daily landing quota, mandatory island ","sc":8,"season":["spring","summer","autumn","winter"],"td":"Tiny island (~300 residents) hosting a resident pod of ~150 Indo-Pacific bottlenose dolphins. Snorkel swims operate Apr–Nov under a strict village permit system: daily landing quota, mandatory island lodging and a registered guide — book months ahead","themes":[],"wl":"en","wt":"Mikura-jima"},"ordinalId":"poi875","sourcePath":"assets/js/japan-pois.js"},"names":[{"kind":"primary","language":"en","value":"Mikurajima Dolphin Swim"},{"kind":"alternate","language":"en","value":"Mikura-jima"}],"notabilityScore":8,"originalSourceIds":[{"recordId":"japan-pois.js#875","sourceId":"legacy-curated-pois"}],"quality":{"accessConfidence":0.18,"assessedAt":"2026-07-25","confidence":0.31,"flags":["discovery_lead","legacy_inventory","legacy_provenance_incomplete","sensitivity_not_assessed","unverified_migration_preview"],"freshness":"unknown","geometryConfidence":0.39,"notes":"Unverified migration/discovery preview; migrated without upgrading the evidence status of the legacy record. Unverified migration/discovery preview; not a verified production fact.","verificationStatus":"unverified"},"rationale":"Tiny island (~300 residents) hosting a resident pod of ~150 Indo-Pacific bottlenose dolphins. Snorkel swims operate Apr–Nov under a strict village permit system: daily landing quota, mandatory island","schemaVersion":"1.0.0","seasons":["autumn","spring","summer","winter"],"sensitivity":{"action":"publish","reason":"Location was already public in the legacy application; sensitivity remains unassessed."},"sourceAssertions":[{"confidence":0.31,"evidenceKind":"maintainer_curated","fieldPath":"/","id":"legacy-place:assets-js-japan-pois-js-875:1vwquvb:source","notes":"Migrated from assets/js/japan-pois.js; upstream provenance and licence need review.","observedAt":null,"retrievedAt":null,"sourceId":"legacy-curated-pois","sourceRecordId":"japan-pois.js#875","validFrom":null,"validUntil":null,"verificationStatus":"unverified"},{"confidence":0.31,"evidenceKind":"maintainer_curated","fieldPath":"/geometry","id":"legacy-place:assets-js-japan-pois-js-875:1vwquvb:geometry","notes":"Migrated from assets/js/japan-pois.js; upstream provenance and licence need review.","observedAt":null,"retrievedAt":null,"sourceId":"legacy-curated-pois","sourceRecordId":"japan-pois.js#875","validFrom":null,"validUntil":null,"verificationStatus":"unverified"},{"confidence":0.31,"evidenceKind":"maintainer_curated","fieldPath":"/names","id":"legacy-place:assets-js-japan-pois-js-875:1vwquvb:names","notes":"Migrated from assets/js/japan-pois.js; upstream provenance and licence need review.","observedAt":null,"retrievedAt":null,"sourceId":"legacy-curated-pois","sourceRecordId":"japan-pois.js#875","validFrom":null,"validUntil":null,"verificationStatus":"unverified"}],"summary":"Tiny island (~300 residents) hosting a resident pod of ~150 Indo-Pacific bottlenose dolphins. Snorkel swims operate Apr–Nov under a strict village permit system: daily landing quota, mandatory island lodging and a registered guide — book months ahead","themes":[],"typicalVisitMinutes":120}],"generated":true,"schemaVersion":"1.0.0","shardCount":1,"shardIndex":0,"x":227,"y":102,"zoom":8}
